commit	val_bpb	memory_gb	status	description
a10g-bs16	1.324339	6.0	KEEP	Baseline: DEVICE_BATCH_SIZE 128->16, grad_accum 16, TOTAL_BATCH_SIZE fixed
a10g-bs32	1.322980	11.7	KEEP	DEVICE_BATCH_SIZE 32 (grad_accum 8): +0.1% val_bpb, ~3% more tok/s; A10G is compute-bound
a10g-bs64		22.0	CRASH	DEVICE_BATCH_SIZE 64 OOMs on 24GB (logits 131072x8192)
a10g-depth12	1.594283	13.2	discard	DEPTH 12 (135M params, batch16): 2.7x slower steps, only 54 steps/28M tokens in 5min budget -> much worse. Keep depth 8.
