commit	val_bpb	memory_gb	status	description
2fb7283	1.296352	11.4	keep	MATRIX_LR 0.04->0.05 (Muon)
932be52	1.273782	11.4	keep	MATRIX_LR 0.05->0.07
9f980f0	1.264579	11.4	keep	MATRIX_LR 0.07->0.10
c7946f5	1.279176	11.4	discard	MATRIX_LR 0.10->0.13 (overshoot, reverted)
7c7d232	1.263939	11.4	keep	EMBEDDING_LR 0.6->0.8 (marginal -0.0006)
8081829	1.356888	11.4	discard	WARMUP_RATIO 0.0->0.1 (wastes budget at fixed 5min, reverted)
3360043	1.268674	11.4	discard	WINDOW_PATTERN SSSL->SSLL (more global attn, slower, reverted)
741d0ae	1.279058	11.4	discard	ADAM_BETAS beta1 0.8->0.9 (reverted)
1be2c9f	1.272366	11.4	discard	WEIGHT_DECAY 0.2->0.05 (overfits short run, reverted)
1fba22b	1.247866	11.4	keep	UNEMBEDDING_LR 0.004->0.008 (new best -0.016)
87d6764	1.277463	11.4	discard	UNEMBEDDING_LR 0.008->0.015 (overshoot, reverted)
7c70731	1.191739	11.4	keep	ASPECT_RATIO 64->48 (narrower=175 steps vs 125, new best -0.056)
3e82ad0	1.191705	8.8	keep	ASPECT_RATIO 48->40 (tie, less VRAM; curve bottomed ~48)
07217d7	1.308360	10.5	discard	DEPTH 8->10 (only 104 steps, depth bad under fixed budget, reverted)
0a4e955	1.192794	8.8	discard	MATRIX_LR 0.13 at narrow (tie-worse, 0.10 still optimal, reverted)
3e82ad0	1.192794	8.8	discard	MATRIX_LR 0.13 at narrow (tie-worse, 0.10 still optimal, reverted)
7a5a6f2	1.198186	7.8	discard	n_kv_head=1 MQA (faster/183 steps but less capacity, reverted)
8d06d23	1.208599	10.3	discard	MLP 4x->6x (slower/153 steps, reverted)
23c54b6	1.182112	8.0	keep	MLP 4x->3x (leaner=191 steps, new best -0.010)
5f01e16	1.176152	7.2	keep	MLP 3x->2x (213 steps, new best -0.006)
a058880	1.176175	6.4	discard	MLP 2x->1x (tie, 2x optimal by simplicity, reverted)
499311f	1.175458	7.2	keep	UNEMBEDDING_LR 0.008->0.012 (lean re-tune, marginal -0.0007)
fb61372	1.176286	7.2	discard	SCALAR_LR 0.5->1.0 (neutral, reverted)
32d0d27	1.197464	6.2	discard	HEAD_DIM 128->64 (finer attn hurts quality, reverted)
0550855	1.174874	5.1	keep	ASPECT_RATIO 40->32 (335 steps, marginal new best -0.0006)
6024750	1.174978	5.1	discard	ASPECT_RATIO 32->28 (tie, 32 is width floor, reverted)
